{
  "schema_version": "0.1",
  "suite": "offline",
  "environment": {
    "python": "3.11.15",
    "platform": "Windows-10-10.0.26200-SP0"
  },
  "timestamp": "2026-08-02T10:38:55Z",
  "benchmarks": [
    {
      "name": "gateway.chat_completion.median_latency_ms",
      "unit": "ms",
      "value": 0.04,
      "samples": [
        0.06,
        0.02
      ]
    },
    {
      "name": "gateway.chat_completion.throughput_per_sec",
      "unit": "completions/s",
      "value": 25906.73,
      "samples": []
    },
    {
      "name": "cli.validate_context.median_ms",
      "unit": "ms",
      "value": 20.25,
      "samples": [
        30.85,
        9.65
      ]
    },
    {
      "name": "cli.build_twin.median_ms",
      "unit": "ms",
      "value": 12.41,
      "samples": [
        14.28,
        10.54
      ]
    },
    {
      "name": "aics.validate.median_ms",
      "unit": "ms",
      "value": 12.03,
      "samples": [
        20.84,
        3.22
      ]
    }
  ]
}
